{
  "schema_version": "0.1",
  "constructor_id": "benchmark-l2-projection",
  "constructor_version": "0.1",
  "objective": "l2_distance_to_policy_adjusted_benchmark",
  "preference": {
    "aggregation": "unique_rule_signed_sum_clamp",
    "tilt_strength": 0.5,
    "score_min": -1.0,
    "score_max": 1.0
  },
  "constraints": {
    "long_only": true,
    "fully_invested": true,
    "max_single_name_weight": 0.1,
    "exclude_weight": 0.0
  },
  "identity": {
    "unmapped_behavior": "retain_unscreened_at_benchmark_reference",
    "disputed_behavior": "fail_closed"
  },
  "decision_semantics": {
    "watch_behavior": "eligible_no_automatic_tilt",
    "none_behavior": "eligible_no_automatic_tilt",
    "none_is_pass": false
  },
  "solver": {
    "library": "cvxpy",
    "library_version": "1.9.2",
    "name": "OSQP",
    "python_package_version": "1.1.3",
    "warm_start": false,
    "eps_abs": 1e-8,
    "eps_rel": 1e-8,
    "max_iter": 100000,
    "polishing": true,
    "adaptive_rho": false
  },
  "numerical": {
    "input_weight_tolerance": 1e-8,
    "feasibility_tolerance": 1e-10,
    "output_invariant_tolerance": 1e-8,
    "semantic_weight_decimals": 12,
    "rounding_mode": "ROUND_HALF_EVEN"
  },
  "paper_only": true
}
